{
  "schema_version": "ai-verse.repository-state/v1",
  "state_id": "ai-verse.repository-network",
  "registry_binding": {
    "path": "governance/repository-registry.json",
    "schema_version": "ai-verse.repository-registry/v1",
    "blob_sha": "88839264a3270d65d21297ade089f111aa843975"
  },
  "refresh": {
    "mode": "full-refresh",
    "scope": "global",
    "status": "complete",
    "repository_ids": [
      1367664026,
      1350081263,
      1361862361,
      1362233598,
      1361910454,
      1362243580,
      1364457521,
      1368762130,
      1368762786,
      1362278774,
      1368748835,
      1364458279,
      1362252045,
      1364456634
    ],
    "evidence_revision": "e9858192a46a11b1a080f6e695460b9825e0652a",
    "last_scoped_refresh": {
      "scope": "global",
      "status": "complete",
      "evidence_revision": "e9858192a46a11b1a080f6e695460b9825e0652a",
      "observed_at": "2026-10-19T17:05:28Z"
    },
    "last_full_refresh": {
      "scope": "global",
      "status": "complete",
      "evidence_revision": "e9858192a46a11b1a080f6e695460b9825e0652a",
      "observed_at": "2026-10-19T17:05:28Z"
    }
  },
  "watchdog": {
    "status": "WATCHDOG-CURRENT",
    "heartbeat_revision": "e9858192a46a11b1a080f6e695460b9825e0652a",
    "last_successful_full_scan": {
      "scope": "global",
      "status": "complete",
      "evidence_revision": "e9858192a46a11b1a080f6e695460b9825e0652a",
      "observed_at": "2026-10-19T17:05:28Z"
    },
    "reason": "Successful Registry-derived global heartbeat at 2026-10-19T17:05:28Z; all registered repositories were scanned with no access/fetch failure."
  },
  "repositories": [
    {
      "repository_id": 1367664026,
      "access": "verified",
      "observed_head": "e9858192a46a11b1a080f6e695460b9825e0652a",
      "owner_acceptance": {
        "status": "not-applicable",
        "revision": null,
        "evidence_refs": []
      },
      "distribution_pin": {
        "status": "not-applicable",
        "revision": null,
        "release_id": null,
        "evidence_refs": []
      },
      "descriptor": {
        "status": "not-applicable",
        "revision": null,
        "release_status": null,
        "blob_sha": null,
        "evidence_refs": []
      },
      "system_sync": {
        "status": "not-applicable",
        "checkpoint_revision": null,
        "evidence_refs": []
      },
      "freshness": {
        "scope": "global",
        "status": "fresh",
        "evidence_revision": "e9858192a46a11b1a080f6e695460b9825e0652a"
      }
    },
    {
      "repository_id": 1350081263,
      "access": "verified",
      "observed_head": "aff6348ba0321adabe063685866f43bcaf083d75",
      "owner_acceptance": {
        "status": "accepted",
        "revision": "1e05ea2c491a8fba85b9ce1b1a1e65d4b53f11f5",
        "evidence_refs": [
          "aiverse-filmmakers/ai-verse-distribution@aff6348ba0321adabe063685866f43bcaf083d75:release/component-release.json"
        ]
      },
      "distribution_pin": {
        "status": "not-applicable",
        "revision": null,
        "release_id": null,
        "evidence_refs": []
      },
      "descriptor": {
        "status": "observed",
        "revision": "1e05ea2c491a8fba85b9ce1b1a1e65d4b53f11f5",
        "release_status": "accepted",
        "blob_sha": "3f48d21ee812678f9b7e79216416914c91ece485",
        "evidence_refs": [
          "aiverse-filmmakers/ai-verse-distribution@aff6348ba0321adabe063685866f43bcaf083d75:release/component-release.json"
        ]
      },
      "system_sync": {
        "status": "unverified",
        "checkpoint_revision": null,
        "evidence_refs": []
      },
      "freshness": {
        "scope": "global",
        "status": "fresh",
        "evidence_revision": "e9858192a46a11b1a080f6e695460b9825e0652a"
      }
    },
    {
      "repository_id": 1361862361,
      "access": "verified",
      "observed_head": "37f14c85e480c405be573bb3aeab54dd4bc1e3da",
      "owner_acceptance": {
        "status": "accepted",
        "revision": "558f4ecb2f6810b10a0e152bfcf610e725fc7032",
        "evidence_refs": [
          "aiverse-filmmakers/AI-Verse-OS@37f14c85e480c405be573bb3aeab54dd4bc1e3da:release/component-release.json"
        ]
      },
      "distribution_pin": {
        "status": "pinned",
        "revision": "64f7325444d18f94c9d4755d32eb89f3468bda6b",
        "release_id": "core-first-run-rc1-2026-10-12",
        "evidence_refs": [
          "aiverse-filmmakers/ai-verse-distribution@aff6348ba0321adabe063685866f43bcaf083d75:release-sets/core-first-run-rc1-2026-10-12.json"
        ]
      },
      "descriptor": {
        "status": "observed",
        "revision": "558f4ecb2f6810b10a0e152bfcf610e725fc7032",
        "release_status": "accepted",
        "blob_sha": "2869ed1fa9b1dc316db988961fcdd5e5e6a7b2c2",
        "evidence_refs": [
          "aiverse-filmmakers/AI-Verse-OS@37f14c85e480c405be573bb3aeab54dd4bc1e3da:release/component-release.json"
        ]
      },
      "system_sync": {
        "status": "synchronized",
        "checkpoint_revision": "9670131477054f173993bbb93be575a3f31f9e9b",
        "evidence_refs": [
          "aiverse-filmmakers/AI-Verse-System@9670131477054f173993bbb93be575a3f31f9e9b:components/ai-verse-os/COMPONENT-SPEC.md",
          "aiverse-filmmakers/AI-Verse-System@9670131477054f173993bbb93be575a3f31f9e9b:components/ai-verse-os/SOURCE-MAP.md",
          "aiverse-filmmakers/AI-Verse-System@9670131477054f173993bbb93be575a3f31f9e9b:components/ai-verse-os/QC.md",
          "aiverse-filmmakers/AI-Verse-System@9670131477054f173993bbb93be575a3f31f9e9b:docs/MASTER-PLAN.md",
          "aiverse-filmmakers/AI-Verse-System@9670131477054f173993bbb93be575a3f31f9e9b:docs/FINAL-AI-VERSE-BLUEPRINT.md",
          "aiverse-filmmakers/AI-Verse-OS@37f14c85e480c405be573bb3aeab54dd4bc1e3da:release/component-release.json"
        ]
      },
      "freshness": {
        "scope": "global",
        "status": "fresh",
        "evidence_revision": "e9858192a46a11b1a080f6e695460b9825e0652a"
      }
    },
    {
      "repository_id": 1362233598,
      "access": "verified",
      "observed_head": "39336cd19eb4600d5ece58f5649f0c494cd02754",
      "owner_acceptance": {
        "status": "accepted",
        "revision": "f746806e4361c2b1cd67ee97810071cc86db7b9a",
        "evidence_refs": [
          "aiverse-filmmakers/AI-Verse-Brain@39336cd19eb4600d5ece58f5649f0c494cd02754:release/component-release.json"
        ]
      },
      "distribution_pin": {
        "status": "pinned",
        "revision": "69f7912eeb35f0178f6952ff0554aec8d7f2c496",
        "release_id": "core-first-run-rc1-2026-10-12",
        "evidence_refs": [
          "aiverse-filmmakers/ai-verse-distribution@aff6348ba0321adabe063685866f43bcaf083d75:release-sets/core-first-run-rc1-2026-10-12.json"
        ]
      },
      "descriptor": {
        "status": "observed",
        "revision": "f746806e4361c2b1cd67ee97810071cc86db7b9a",
        "release_status": "accepted",
        "blob_sha": "9a1ccb4be8851351f5262de78506f8e4f82ebb56",
        "evidence_refs": [
          "aiverse-filmmakers/AI-Verse-Brain@39336cd19eb4600d5ece58f5649f0c494cd02754:release/component-release.json"
        ]
      },
      "system_sync": {
        "status": "synchronized",
        "checkpoint_revision": "9670131477054f173993bbb93be575a3f31f9e9b",
        "evidence_refs": [
          "aiverse-filmmakers/AI-Verse-System@9670131477054f173993bbb93be575a3f31f9e9b:components/ai-verse-brain/COMPONENT-SPEC.md",
          "aiverse-filmmakers/AI-Verse-System@9670131477054f173993bbb93be575a3f31f9e9b:components/ai-verse-brain/SOURCE-MAP.md",
          "aiverse-filmmakers/AI-Verse-System@9670131477054f173993bbb93be575a3f31f9e9b:components/ai-verse-brain/QC.md",
          "aiverse-filmmakers/AI-Verse-System@9670131477054f173993bbb93be575a3f31f9e9b:docs/MASTER-PLAN.md",
          "aiverse-filmmakers/AI-Verse-System@9670131477054f173993bbb93be575a3f31f9e9b:docs/FINAL-AI-VERSE-BLUEPRINT.md",
          "aiverse-filmmakers/AI-Verse-Brain@39336cd19eb4600d5ece58f5649f0c494cd02754:release/component-release.json"
        ]
      },
      "freshness": {
        "scope": "global",
        "status": "fresh",
        "evidence_revision": "e9858192a46a11b1a080f6e695460b9825e0652a"
      }
    },
    {
      "repository_id": 1361910454,
      "access": "verified",
      "observed_head": "09911eae0b4b0cbf7e7e7969230fe5b86647b841",
      "owner_acceptance": {
        "status": "accepted",
        "revision": "f1327be48ba2ee0043959021365e6dbb9dcb1d3a",
        "evidence_refs": [
          "aiverse-filmmakers/AI-Verse-Memory@09911eae0b4b0cbf7e7e7969230fe5b86647b841:release/component-release.json"
        ]
      },
      "distribution_pin": {
        "status": "pinned",
        "revision": "f1327be48ba2ee0043959021365e6dbb9dcb1d3a",
        "release_id": "core-first-run-rc1-2026-10-12",
        "evidence_refs": [
          "aiverse-filmmakers/ai-verse-distribution@aff6348ba0321adabe063685866f43bcaf083d75:release-sets/core-first-run-rc1-2026-10-12.json"
        ]
      },
      "descriptor": {
        "status": "observed",
        "revision": "f1327be48ba2ee0043959021365e6dbb9dcb1d3a",
        "release_status": "accepted",
        "blob_sha": "63b4607fbcb07a8bd040239cdf6201d40eeab050",
        "evidence_refs": [
          "aiverse-filmmakers/AI-Verse-Memory@09911eae0b4b0cbf7e7e7969230fe5b86647b841:release/component-release.json"
        ]
      },
      "system_sync": {
        "status": "synchronized",
        "checkpoint_revision": "3c5715230f10eec15d96fc4d349490fd0c4e9f1b",
        "evidence_refs": [
          "aiverse-filmmakers/AI-Verse-System@3c5715230f10eec15d96fc4d349490fd0c4e9f1b:components/ai-verse-memory/COMPONENT-SPEC.md",
          "aiverse-filmmakers/AI-Verse-System@3c5715230f10eec15d96fc4d349490fd0c4e9f1b:components/ai-verse-memory/SOURCE-MAP.md",
          "aiverse-filmmakers/AI-Verse-System@3c5715230f10eec15d96fc4d349490fd0c4e9f1b:components/ai-verse-memory/QC.md",